@Akshar Jitendra Hate.
Date : 22/05/2022

******************************************************

Welcome to payroll service using MySQL.

******************************************************

UC1: Ability to create a payroll service database

******************************************************

mysql> SHOW DATABASES;
+--------------------+
| Database           |
+--------------------+
| customer           |
| employees          |
| information_schema |
| mysql              |
| performance_schema |
| sys                |
+--------------------+
6 rows in set (0.00 sec)

mysql> CREATE DATABASE payroll_service;
Query OK, 1 row affected (0.01 sec)

mysql> USE payroll_service;
Database changed
mysql> SELECT DATABASE();
+-----------------+
| DATABASE()      |
+-----------------+
| payroll_service |
+-----------------+
1 row in set (0.00 sec)

******************************************************

UC2: Ability to create a employee payroll table in the
payroll service database to manage employee payrolls

******************************************************

mysql> CREATE TABLE employee_payroll
    -> (id INT unsigned NOT NULL AUTO_INCREMENT,
    -> name VARCHAR(150) NOT NULL,
    -> salary Double NOT NULL,
    -> start DATE NOT NULL,
    -> PRIMARY KEY (id)
    -> );
Query OK, 0 rows affected (0.11 sec)

mysql> DESCRIBE employee_payroll;
+--------+--------------+------+-----+---------+----------------+
| Field  | Type         | Null | Key | Default | Extra          |
+--------+--------------+------+-----+---------+----------------+
| id     | int unsigned | NO   | PRI | NULL    | auto_increment |
| name   | varchar(150) | NO   |     | NULL    |                |
| salary | double       | NO   |     | NULL    |                |
| start  | date         | NO   |     | NULL    |                |
+--------+--------------+------+-----+---------+----------------+
4 rows in set (0.05 sec)

******************************************************

UC3: Ability to create employee payroll data in the
payroll service database as part of CURD Operation

******************************************************

mysql> INSERT INTO employee_payroll(name, salary, start) VALUES
    -> ('Akshar', 10000.00, '2020-01-21'),
    -> ('Yogesh', 15000.00, '2021-07-02'),
    -> ('Raj', 20000.00, '2022-02-15');
Query OK, 3 rows affected (0.06 sec)
Records: 3  Duplicates: 0  Warnings: 0

mysql> SELECT * FROM employee_payroll;
+----+--------+--------+------------+
| id | name   | salary | start      |
+----+--------+--------+------------+
|  1 | Akshar |  10000 | 2020-01-21 |
|  2 | Yogesh |  15000 | 2021-07-02 |
|  3 | Raj    |  20000 | 2022-02-15 |
+----+--------+--------+------------+
3 rows in set (0.04 sec)

mysql> UPDATE employee_payroll
    -> SET salary = 13000.00
    -> WHERE id = 1;
Query OK, 1 row affected (0.04 sec)
Rows matched: 1  Changed: 1  Warnings: 0

mysql> SELECT * FROM employee_payroll;
+----+--------+--------+------------+
| id | name   | salary | start      |
+----+--------+--------+------------+
|  1 | Akshar |  13000 | 2020-01-21 |
|  2 | Yogesh |  15000 | 2021-07-02 |
|  3 | Raj    |  20000 | 2022-02-15 |
+----+--------+--------+------------+
3 rows in set (0.04 sec)

mysql> DELETE FROM employee_payroll
    -> WHERE name = 'Raj';
Query OK, 1 row affected (0.04 sec)

mysql> SELECT * FROM employee_payroll;
+----+--------+--------+------------+
| id | name   | salary | start      |
+----+--------+--------+------------+
|  1 | Akshar |  13000 | 2020-01-21 |
|  2 | Yogesh |  15000 | 2021-07-02 |
+----+--------+--------+------------+
2 rows in set (0.00 sec)

mysql> INSERT INTO employee_payroll(name, salary, start) VALUES
    -> ('Swati', 30000.00, '2019-05-13');
Query OK, 1 row affected (0.04 sec)

******************************************************

UC4: Ability to retrieve all the employee payroll data
that is added to payroll service database

******************************************************

mysql> SELECT * FROM employee_payroll;
+----+--------+--------+------------+
| id | name   | salary | start      |
+----+--------+--------+------------+
|  1 | Akshar |  13000 | 2020-01-21 |
|  2 | Yogesh |  15000 | 2021-07-02 |
|  4 | Swati  |  30000 | 2019-05-13 |
+----+--------+--------+------------+
3 rows in set (0.04 sec)

******************************************************

UC5: Ability to retrieve salary data for a particular
employee as well as all employees who have joined in a
particular data range from the payroll service database

******************************************************

mysql> SELECT salary FROM employee_payroll
    -> WHERE name = 'Swati';
+--------+
| salary |
+--------+
|  30000 |
+--------+
1 row in set (0.00 sec)

mysql> SELECT * FROM employee_payroll WHERE start BETWEEN CAST('2020-01-01' AS DATE) AND DATE(NOW());
+----+--------+--------+------------+
| id | name   | salary | start      |
+----+--------+--------+------------+
|  1 | Akshar |  13000 | 2020-01-21 |
|  2 | Yogesh |  15000 | 2021-07-02 |
+----+--------+--------+------------+
2 rows in set (0.04 sec)

******************************************************

UC6: Ability to add Gender to Employee Payroll Table
and Update the Rows to reflect the correct Employee Gender

******************************************************

mysql> ALTER TABLE employee_payroll ADD gender CHAR(1) AFTER name;
Query OK, 0 rows affected (0.18 sec)
Records: 0  Duplicates: 0  Warnings: 0

mysql> UPDATE employee_payroll set gender = 'M' WHERE name = 'Akshar';
Query OK, 1 row affected (0.04 sec)
Rows matched: 1  Changed: 1  Warnings: 0

mysql> select * from employee_payroll;
+----+--------+--------+--------+------------+
| id | name   | gender | salary | start      |
+----+--------+--------+--------+------------+
|  1 | Akshar | M      |  13000 | 2020-01-21 |
|  2 | Yogesh | NULL   |  15000 | 2021-07-02 |
|  4 | Swati  | NULL   |  30000 | 2019-05-13 |
+----+--------+--------+--------+------------+
3 rows in set (0.00 sec)

******************************************************

UC7: Ability to find sum, average, min, max and number
of male and female employees

******************************************************

mysql> SELECT SUM(salary) FROM employee_payroll WHERE gender = 'M' GROUP BY gender;
+-------------+
| SUM(salary) |
+-------------+
|       28000 |
+-------------+
1 row in set (0.04 sec)

mysql> SELECT AVG(salary) FROM employee_payroll WHERE gender = 'M' GROUP BY gender;
+-------------+
| AVG(salary) |
+-------------+
|       14000 |
+-------------+
1 row in set (0.00 sec)

mysql> SELECT MIN(salary) FROM employee_payroll WHERE gender = 'M' GROUP BY gender;
+-------------+
| MIN(salary) |
+-------------+
|       13000 |
+-------------+
1 row in set (0.04 sec)

mysql> SELECT MAX(salary) FROM employee_payroll WHERE gender = 'M' GROUP BY gender;
+-------------+
| MAX(salary) |
+-------------+
|       15000 |
+-------------+
1 row in set (0.00 sec)

mysql> SELECT COUNT(salary) FROM employee_payroll WHERE gender = 'M' GROUP BY gender;
+---------------+
| COUNT(salary) |
+---------------+
|             2 |
+---------------+
1 row in set (0.00 sec)


******************************************************

UC8: Ability to extend employee_payroll data to store
employee information like employee phone, address and
department

******************************************************

mysql> ALTER TABLE employee_payroll
    -> ADD PhoneNumber VARCHAR(250) AFTER name,
    -> ADD Address VARCHAR(250) AFTER PhoneNumber,
    -> ADD Department VARCHAR (250) NOT NULL AFTER Address;
Query OK, 0 rows affected (0.17 sec)
Records: 0  Duplicates: 0  Warnings: 0

mysql> DESCRIBE employee_payroll;
+-------------+--------------+------+-----+---------+----------------+
| Field       | Type         | Null | Key | Default | Extra          |
+-------------+--------------+------+-----+---------+----------------+
| id          | int unsigned | NO   | PRI | NULL    | auto_increment |
| name        | varchar(150) | NO   |     | NULL    |                |
| PhoneNumber | varchar(250) | YES  |     | NULL    |                |
| Address     | varchar(250) | YES  |     | NULL    |                |
| Department  | varchar(250) | NO   |     | NULL    |                |
| gender      | char(1)      | YES  |     | NULL    |                |
| salary      | double       | NO   |     | NULL    |                |
| start       | date         | NO   |     | NULL    |                |
+-------------+--------------+------+-----+---------+----------------+
8 rows in set (0.05 sec)


******************************************************

UC9: Ability to extend employee_payroll table to have
Basic Pay, Deductions, Taxable Pay, Income Tax, Net Pay

******************************************************

mysql> ALTER TABLE employee_payroll RENAME COLUMN salary TO BasicPay;
Query OK, 0 rows affected (0.09 sec)
Records: 0  Duplicates: 0  Warnings: 0

mysql> ALTER TABLE employee_payroll
    -> ADD Deductions DOUBLE NOT NULL AFTER BasicPay,
    -> ADD TaxablePay Double NOT NULL AFTER Deductions,
    -> ADD IncomeTax Double NOT NULL AFTER TaxablePay,
    -> ADD NetPay DOUBLE NOT NULL AFTER IncomeTax;
Query OK, 0 rows affected (0.19 sec)
Records: 0  Duplicates: 0  Warnings: 0

mysql> DESCRIBE employee_payroll;
+-------------+--------------+------+-----+---------+----------------+
| Field       | Type         | Null | Key | Default | Extra          |
+-------------+--------------+------+-----+---------+----------------+
| id          | int unsigned | NO   | PRI | NULL    | auto_increment |
| name        | varchar(150) | NO   |     | NULL    |                |
| PhoneNumber | varchar(250) | YES  |     | NULL    |                |
| Address     | varchar(250) | YES  |     | NULL    |                |
| Department  | varchar(250) | NO   |     | NULL    |                |
| gender      | char(1)      | YES  |     | NULL    |                |
| BasicPay    | double       | NO   |     | NULL    |                |
| Deductions  | double       | NO   |     | NULL    |                |
| TaxablePay  | double       | NO   |     | NULL    |                |
| IncomeTax   | double       | NO   |     | NULL    |                |
| NetPay      | double       | NO   |     | NULL    |                |
| start       | date         | NO   |     | NULL    |                |
+-------------+--------------+------+-----+---------+----------------+
12 rows in set (0.01 sec)